id,status_groundtruth,title,content,tanggal
35278,Salah,"Tidak Benar, Bahlil Umumkan Harga Pertamax Turun Jadi Rp10.500","tirto.id - Isu terkait penyesuaian harga BBM non-subsidi seperti Pertamax, pembatasan pembelian BBM, dan kepastian pasokan nasional terus menjadi sorotan di tengah dinamika harga minyak dunia. Teranyar, beredar di media sosial Facebook unggahan yang mengklaim Menteri Energi dan Sumber Daya Mineral RI Bahlil Lahadalia mengumumkan penurunan harga Pertamax menjadi Rp10.500 dampak dari minyak dunia yang mulai turun. let gpt_inline2 = window.googletag || {cmd: []};gpt_inline2.cmd.push(function() {gpt_inline2.defineSlot('/22201407306/tirto-desktop/inline-2', [[336, 280], [300, 250]], 'gpt-inline2-passback').addService(gpt_inline2.pubads());gpt_inline2.pubads().enableSingleRequest();gpt_inline2.pubads().collapseEmptyDivs();gpt_inline2.enableServices();gpt_inline2.display('gpt-inline2-passback');}); Unggahan tersebut disebarkan oleh akun Facebook bernama “Desita Dini” (arsip) pada Selasa (16/06/2026). Unggahan tersebut menampilkan gambar Bahlil seperti tengah diwawancarai. let gpt_inline3 = window.googletag || {cmd: []};gpt_inline3.cmd.push(function() {gpt_inline3.defineSlot('/22201407306/tirto-desktop/inline-3', [[336, 280], [300, 250]], 'gpt-inline3-passback').addService(gpt_inline3.pubads());gpt_inline3.pubads().enableSingleRequest();gpt_inline3.pubads().collapseEmptyDivs();gpt_inline3.enableServices();gpt_inline3.display('gpt-inline3-passback');}); #gpt-inline3-passback{text-align:center;} “Bahlil Menegaskan Pertamax Menjadi 10.500 per Liter Mulai Besok Karena Harga Minyak Dunia Mulai Turun,” begitu narasi tertulis dalam gambar. let gpt_inline4 = window.googletag || {cmd: []};gpt_inline4.cmd.push(function() {gpt_inline4.defineSlot('/22201407306/tirto-desktop/inline-4', [[336, 280], [300, 250]], 'gpt-inline4-passback').addService(gpt_inline4.pubads());gpt_inline4.pubads().enableSingleRequest();gpt_inline4.pubads().collapseEmptyDivs();gpt_inline4.enableServices();gpt_inline4.display('gpt-inline4-passback');}); #gpt-inline4-passback{text-align:center;} Pengunggah juga menambahkan keterangan, “MBGmas bahlil ganteng. Harga minyak dunia turun, dampaknya harga BBM non- subsidi di Indonesia bakal diturunkan. Itu janji Pak Bahlil. Selama ini Pak Bahlil, senantiasa menjaga ucapannya.” Sampai artikel ini ditulis pada Kamis (18/06/2026), unggahan tersebut telah mendapatkan 136 likes, 51 komentar, dan 5 kali dibagikan. Kolom komentar dipenuhi pertanyaan masyarakat terkait kebenaran informasi tersebut. Tirto juga menemukan unggahan serupa pada akun Facebook “Sar Aneuk Aceh,” “Dani Maulana,” dan ""Sarwansyah"". Semua unggahan tersebut menampilkan gambar serupa terkait klaim Bahlil umumkan harga Pertamax turun Rp10.500 imbas turunnya harga minyak dunia. Lantas, bagaimana kebenaran klaim tersebut? Baca juga:DPR: Mengikuti Minyak Dunia, Harga Pertamax Harusnya Rp20 Ribu Periksa Fakta harga pertamax turun. foto/Hotline periksa faktatirto",2026-06-18
35277,Salah,"Salah, Jubir ESDM Minta Warga Pakai Solar Jika Pertamax Naik","tirto.id - Beredar unggahan di media sosial Threads mengklaim sebuah artikel diterbitkan dengan menuliskan klaim bahwa Juru Bicara Kementerian ESDM Dwi Anggia meminta masyarakat untuk menggunakan solar yang berharga murah sebagai ganti jika Pertamax naik harga. Unggahan tersebut disebarkan oleh akun Threads @wildan_sma (arsip) pada Senin (15/06/2026). Dalam unggahan tersebut memperlihatkan Dwi Anggia mengenakan baju putih dan kerudung merah muda. let gpt_inline2 = window.googletag || {cmd: []};gpt_inline2.cmd.push(function() {gpt_inline2.defineSlot('/22201407306/tirto-desktop/inline-2', [[336, 280], [300, 250]], 'gpt-inline2-passback').addService(gpt_inline2.pubads());gpt_inline2.pubads().enableSingleRequest();gpt_inline2.pubads().collapseEmptyDivs();gpt_inline2.enableServices();gpt_inline2.display('gpt-inline2-passback');}); “KOMPOS.CORN. Pertamax Jadi Rp 16.250 per Liter. Dwi Anggia, selaku Jubir Menteri ESDM : Ada Solar Yang Murah, Pakai Itu Saja. Sama-sama BBM kan?” Begitu narasi tertulis dalam gambar. let gpt_inline3 = window.googletag || {cmd: []};gpt_inline3.cmd.push(function() {gpt_inline3.defineSlot('/22201407306/tirto-desktop/inline-3', [[336, 280], [300, 250]], 'gpt-inline3-passback').addService(gpt_inline3.pubads());gpt_inline3.pubads().enableSingleRequest();gpt_inline3.pubads().collapseEmptyDivs();gpt_inline3.enableServices();gpt_inline3.display('gpt-inline3-passback');}); #gpt-inline3-passback{text-align:center;} Pengunggah juga menuliskan narasi, “Mungkin ibu ini gak tau kalo Mobil Juga pake OLI 😁,” dalam unggahan tersebut. let gpt_inline4 = window.googletag || {cmd: []};gpt_inline4.cmd.push(function() {gpt_inline4.defineSlot('/22201407306/tirto-desktop/inline-4', [[336, 280], [300, 250]], 'gpt-inline4-passback').addService(gpt_inline4.pubads());gpt_inline4.pubads().enableSingleRequest();gpt_inline4.pubads().collapseEmptyDivs();gpt_inline4.enableServices();gpt_inline4.display('gpt-inline4-passback');}); #gpt-inline4-passback{text-align:center;} Sampai artikel ini ditulis pada Rabu (17/06/2026), unggahan tersebut telah mendapatkan 2 komentar dan 186 kali dilihat. Salah satu komentar menuliskan kritik terhadap pemerintahan. “Ya Tuhan , Indonesia ngak kekurangan orang pintar ...kenapa yg masuk pemerintahan sebagian besar orang 1/2 kurang full gini 😭😭.” Begitu salah satu komentar dalam unggahan. Tirto juga menemukan unggahan serupa pada akun Facebook “Lala Lele,” akun Instagram @viralitasterkini dan akun X @LambeSahamjja. Semua unggahan tersebut menampilkan unggahan serupa terkait Jubir ESDM minta warga pakai solar murah jika Pertamax naik harga. Lantas, bagaimana kebenaran klaim tersebut? Baca juga:Harga Pertamax Naik, Warga Beralih ke Pertalite di Subang Periksa Fakta Jubir ESDM. FOTO/Hotline Periksa Fakta Tirto",2026-06-18
35276,Salah,"Keliru, AstraZeneca Berarti Jalan Menuju Kematian","tirto.id - Vaksin rentan dijadikan berita misinformasi dengan menyebutkan berbagai klaim dan narasi yang tidak memiliki referensi yang jelas. Salah satu yang kembali beredar adalah sebuah unggahan di media sosial Facebook mengklaim AstraZeneca memiliki arti nama sebagai jalan menuju kematian. Narasi ini dapat memicu kepanikan dan ketakutan masyarakat dalam penggunaan vaksin. let gpt_inline2 = window.googletag || {cmd: []};gpt_inline2.cmd.push(function() {gpt_inline2.defineSlot('/22201407306/tirto-desktop/inline-2', [[336, 280], [300, 250]], 'gpt-inline2-passback').addService(gpt_inline2.pubads());gpt_inline2.pubads().enableSingleRequest();gpt_inline2.pubads().collapseEmptyDivs();gpt_inline2.enableServices();gpt_inline2.display('gpt-inline2-passback');}); Unggahan tersebut disebarkan oleh akun Facebook bernama “Olipyu” (arsip) pada Senin (9/2/2026). Unggahan tersebut memperlihatkan terjemahan Google Translate a stra ze neca dari bahasa Latin ke bahasa Indonesia yang diklaim berarti jalan menuju kematian. let gpt_inline3 = window.googletag || {cmd: []};gpt_inline3.cmd.push(function() {gpt_inline3.defineSlot('/22201407306/tirto-desktop/inline-3', [[336, 280], [300, 250]], 'gpt-inline3-passback').addService(gpt_inline3.pubads());gpt_inline3.pubads().enableSingleRequest();gpt_inline3.pubads().collapseEmptyDivs();gpt_inline3.enableServices();gpt_inline3.display('gpt-inline3-passback');}); #gpt-inline3-passback{text-align:center;} “Konspirasi Baru, Kalian ingat?? Nama obat vaksin itu Astra zeneca??? Dan yupp artinya jalan menuju kematian... Njirr merinding,” begitu narasi tertulis dalam keterangan unggahan. let gpt_inline4 = window.googletag || {cmd: []};gpt_inline4.cmd.push(function() {gpt_inline4.defineSlot('/22201407306/tirto-desktop/inline-4', [[336, 280], [300, 250]], 'gpt-inline4-passback').addService(gpt_inline4.pubads());gpt_inline4.pubads().enableSingleRequest();gpt_inline4.pubads().collapseEmptyDivs();gpt_inline4.enableServices();gpt_inline4.display('gpt-inline4-passback');}); #gpt-inline4-passback{text-align:center;} Sampai artikel ini ditulis pada Rabu (17/06/2026), unggahan tersebut telah mendapatkan 19 likes dan 23 komentar. Tirto juga menemukan unggahan serupa pada akun Facebook “Jacky Geovani,” Threads @donnyra, dan X @MurtadhaOne1. Semua unggahan tersebut menampilkan gambar serupa yaitu hasil terjemahan Google Translate AstraZeneca yang berarti jalan menuju kematian. Lantas, benarkah AstraZeneca berarti jalan menuju kematian? Baca juga:BPOM: Manfaat AstraZeneca Lebih Besar daripada Efek Sampingnya Periksa Fakta Arti Astra Zeneca. FOTO/Hotline Periksa Fakta Tirto",2026-06-17
35275,Salah,"Hoaks, Pemadaman Listrik Global 9 Hari Mulai 18 Juli 2026","tirto.id - Sebuah unggahan beredar di media sosial Facebook mengklaim akan ada pemadaman listrik secara global selama 9 hari dimulai pada 18 Juli 2026 sebagai salah satu agenda 2030 dan diam diklaim sebagai solusi dari protokol pemadaman tersebut. Unggahan tersebut disebarkan oleh akun Facebook bernama “Sutri Andini” (arsip) pada Selasa (9/6/2026). Unggahan menampilkan gambar ilustrasi sebuah keluarga memegang lilin dalam situasi pemadaman listrik. let gpt_inline2 = window.googletag || {cmd: []};gpt_inline2.cmd.push(function() {gpt_inline2.defineSlot('/22201407306/tirto-desktop/inline-2', [[336, 280], [300, 250]], 'gpt-inline2-passback').addService(gpt_inline2.pubads());gpt_inline2.pubads().enableSingleRequest();gpt_inline2.pubads().collapseEmptyDivs();gpt_inline2.enableServices();gpt_inline2.display('gpt-inline2-passback');}); “FAKTA NYATA. 18 JULI 2026: PEMADAMAN LISTRIK GLOBAL SELAMA 9 HARI TERHUBUNG DENGAN AGENDA 2030, DIAM ADALAH PROTOKOLNYA.” Begitu narasi tertulis dalam gambar. let gpt_inline3 = window.googletag || {cmd: []};gpt_inline3.cmd.push(function() {gpt_inline3.defineSlot('/22201407306/tirto-desktop/inline-3', [[336, 280], [300, 250]], 'gpt-inline3-passback').addService(gpt_inline3.pubads());gpt_inline3.pubads().enableSingleRequest();gpt_inline3.pubads().collapseEmptyDivs();gpt_inline3.enableServices();gpt_inline3.display('gpt-inline3-passback');}); #gpt-inline3-passback{text-align:center;} Pengunggah juga menuliskan keterangan dalam unggahan tersebut, “24 jam mati lampu aja hampir gilaaak, apalagi smpai 9 hari bisa bisa sak uwonge pun ikut padam.” let gpt_inline4 = window.googletag || {cmd: []};gpt_inline4.cmd.push(function() {gpt_inline4.defineSlot('/22201407306/tirto-desktop/inline-4', [[336, 280], [300, 250]], 'gpt-inline4-passback').addService(gpt_inline4.pubads());gpt_inline4.pubads().enableSingleRequest();gpt_inline4.pubads().collapseEmptyDivs();gpt_inline4.enableServices();gpt_inline4.display('gpt-inline4-passback');}); #gpt-inline4-passback{text-align:center;} Sampai artikel ini ditulis pada Senin (15/06/2026), unggahan tersebut telah mendapatkan 117 likes, 84 komentar, dan 93 kali dibagikan ulang. Kolom komentar diisi dengan kritik masyarakat terhadap informasi tersebut dan meyakini bahwa kabar tersebut tidak benar. “Baru baca sekilas udah kerasa ada yang janggal loh.. untung udah ada klarifikasinya, jangan gampang kemakan informasi yang belum jelas sumbernya.” Begitu tulis salah satu komentar. Tirto juga menemukan unggahan serupa pada akun Facebook “Truth.Seeker 2nd account avicenna,” unggahan tersebut menyebarkan klaim serupa terkait akan adanya pemadaman listrik secara global. “Pada 18 Juli 2026, Sebuah Teori Mulai Beredar: ✦Pemadaman Listrik Global Selama 9 Hari✦ Bukan Gangguan Sistem. Bukan Kecelakaan. Keheningan. Ceritanya Bilang, Ini Bukan Sekadar Pemadaman Listrik — ini Adalah RESET Sistem Yang Terkoordinasi. Jaringan Listrik? Mati. Jaringan Komunikasi? Putus. Satelit? Hilang. Tanpa Peringatan. Tanpa Siaran Darurat. Dunia Tiba-tiba Berhenti.Tanpa Ledakan. Tanpa Kehancuran. Hanya Dengungan Sistem Yang Memudar Sampai Tidak Ada Apa-apa. Dalam Teori Ini, Pemadaman Ini Bukan Tentang Lampu Yang Mati. Ini Tentang Hilangnya Sinyal. Seluruh Kerangka Digital Dimatikan Tanpa Meninggalkan Jejak.Bagian Yang Meresahkan? Teori Ini Mengklaim Ada Protokol Yang Disiapkan Untuk Memastikan Tidak Ada Kebocoran Informasi. Tidak Ada pengumuman. Tidak Ada Kepanikan. Hanya Keheningan Yang Menyelimuti Segalanya. Pertanyaan Sebenarnya: Kenapa Harus Hening? Kenapa Tidak Ada Peringatan? Orang-orang Tidak Sadar Betapa Rapuhnya Dunia Kita. Ini Bukan Cuma Soal Listrik Yang Mati. Ini Tentang Sistem-sistem Yang Saling Terhubung Dan Sinkron Yang Kita Bangun, Yang Bergantung Pada Umpan Balik Konstan. Satu Gangguan Saja, Dan Seluruh Sistem Bisa Retak.Bayangkan: Sembilan Hari. Tanpa Telepon. Tanpa Internet. Tanpa Kontak. Dalam Keheningan Ini, Pertanyaan Sebenarnya Bukan Apa Yang Duluan Rusak. Tapi Siapa Yang Duluan Rusak. Karena Saat Informasi Menghilang, Pikiranmu Akan Mulai Mencarinya. Kamu Akan Panik. Kamu Akan Merasa Kendalimu Lepas. Kesimpulan: Dunia Berjalan Karena Koneksi. Dan Kita Sudah Lupa Cara Berfungsi Tanpa Itu. Kalau Jaringan Listrik Mati, Yang Gelap Bukan Cuma Infrastrukturnya — Pikiranmu Juga.​” Lantas, benarkah mulai tanggal 18 Juli 2026 akan terjadi pemadaman listrik secara global selama 9 hari sebagai bagian dari agenda 2030? Baca juga:Pramono Minta Jangan Ada Lagi Pemadaman Listrik di Jakarta PEriksa Fakta Pemadaman Listrik Global. foto/hotline periksa fakta tirto",2026-06-16
35274,Salah,"Tidak Benar, Pemerintah Batasi Motor Isi Pertalite Rp50 Ribu","tirto.id - Isu terkait BBM dan pembatasan pertalite bukan hal baru, narasi yang sama juga pernah beredar di media sosial beberapa waktu lalu. Baru-baru ini, sebuah unggahan beredar di media sosial Facebook mengklaim pemerintah mengeluarkan kebijakan baru untuk menerapkan pembatasan pengisian bahan bakar minyak jenis pertalite untuk pengendara sepeda motor dengan batas pembelian Rp50 ribu. let gpt_inline2 = window.googletag || {cmd: []};gpt_inline2.cmd.push(function() {gpt_inline2.defineSlot('/22201407306/tirto-desktop/inline-2', [[336, 280], [300, 250]], 'gpt-inline2-passback').addService(gpt_inline2.pubads());gpt_inline2.pubads().enableSingleRequest();gpt_inline2.pubads().collapseEmptyDivs();gpt_inline2.enableServices();gpt_inline2.display('gpt-inline2-passback');}); Unggahan tersebut disebarkan oleh akun Facebook bernama “Kota Ponorogo” (arsip) pada Sabtu (09/05/2026). Dalam unggahan tersebut menampilkan gambar pengisian BBM kendaraan bermotor di SPBU dan terdapat plang bertuliskan “Pembatasan pembelian pertalite maksimal Rp50.000 per transaksi. Khusus kendaraan roda dua.” dibubuhkan dengan logo PT Pertamina (Persero). let gpt_inline3 = window.googletag || {cmd: []};gpt_inline3.cmd.push(function() {gpt_inline3.defineSlot('/22201407306/tirto-desktop/inline-3', [[336, 280], [300, 250]], 'gpt-inline3-passback').addService(gpt_inline3.pubads());gpt_inline3.pubads().enableSingleRequest();gpt_inline3.pubads().collapseEmptyDivs();gpt_inline3.enableServices();gpt_inline3.display('gpt-inline3-passback');}); #gpt-inline3-passback{text-align:center;} “KABAR VIRAL. PEMERINTAH TERAPKAN BATAS PERTALITE RP50 RIBU, KEBIJAKAN BARU UNTUK JAGA DISTRIBUSI SUBSIDI TETAP MERATA. PRO & KONTRA DI MASYARAKAT BANTU KURANGI ANTREAN, NAMUN DITAKUTKAN MEMBERATKAN PEKERJAAN HARIAN.” Begitu narasi dituliskan dalam gambar. let gpt_inline4 = window.googletag || {cmd: []};gpt_inline4.cmd.push(function() {gpt_inline4.defineSlot('/22201407306/tirto-desktop/inline-4', [[336, 280], [300, 250]], 'gpt-inline4-passback').addService(gpt_inline4.pubads());gpt_inline4.pubads().enableSingleRequest();gpt_inline4.pubads().collapseEmptyDivs();gpt_inline4.enableServices();gpt_inline4.display('gpt-inline4-passback');}); #gpt-inline4-passback{text-align:center;} Pengunggah juga menuliskan keterangan dalam unggahan, “Heboh! Pembatasan Pertalite Rp50 Ribu Mulai Diterapkan, Pengendara Motor Langsung Jadi Sorotan. Kebijakan pembatasan pembelian BBM subsidi kini mulai diberlakukan di sejumlah daerah dengan batas maksimal pengisian Pertalite Rp50 ribu untuk motor per transaksi. Pemerintah menyebut aturan ini dibuat agar distribusi BBM lebih merata, mencegah penimbunan, dan mengurangi antrean panjang di SPBU. Namun di lapangan, kebijakan tersebut memicu beragam reaksi, terutama dari pekerja harian dan driver ojek online yang khawatir biaya operasional mereka ikut terdampak. Menurut kalian, aturan ini solusi yang tepat atau justru bikin masyarakat makin sulit? Tulis pendapatmu dan bagikan ke teman-temanmu!” Sampai artikel ini ditulis pada Senin (15/06/2026), unggahan tersebut telah mendapatkan 10 likes dan 2 komentar. Kolom komentar berisi kritik terhadap kebijakan tersebut dan masyarakat mempertanyakan kebenarannya. Tirto juga menemukan unggahan serupa pada akun Facebook “Ardi Nengsih” dan “Crunzz.id.” Kedua unggahan tersebut menyebarkan klaim pembelian BBM bagi kendaraan bermotor resmi dibatasi dengan maksimal pembelian pertalite Rp50 ribu. Lantas, benarkah PT Pertamina (Persero) batasi pembelian pertalite bagi kendaraan roda dua Rp50 ribu? Baca juga:Harga Pertamax Naik, Warga Beralih ke Pertalite di Subang Periksa Fakta Batas Pertalite. foto/hotline periksa fakta tirto",2026-06-15
35273,Salah,"Salah, Dadan Hindayana Sebut Jokowi Terima Suap MBG Rp2 Triliun","tirto.id - Sebuah unggahan video beredar di media sosial Instagram yang mengklaim mantan Kepala Badan Gizi Nasional (BGN) Dadan Hindayana menyebutkan bahwa Joko Widodo, Presiden ke-7 RI, menerima uang suap dari program Makan Bergizi Gratis (MBG) sebesar Rp2 triliun dan mengaku memiliki bukti transfer uang tersebut. Video tersebut diunggah oleh akun Instagram @riodonadonytanjung (arsip) pada Sabtu (06/06/2026). Dalam unggahan video berdurasi 39 detik tersebut, Dadan menampilkan cuplikan pelantikan Dadan sebagai Kepala BGN lalu bersalaman dengan Jokowi. Klip itu juga menyambungkan beberapa audio dengan suara pidato Prabowo terkait inisiasi program MBG serta suara Ustaz Das’ad Latif yang pernah viral mengkritik sapi MBG. let gpt_inline2 = window.googletag || {cmd: []};gpt_inline2.cmd.push(function() {gpt_inline2.defineSlot('/22201407306/tirto-desktop/inline-2', [[336, 280], [300, 250]], 'gpt-inline2-passback').addService(gpt_inline2.pubads());gpt_inline2.pubads().enableSingleRequest();gpt_inline2.pubads().collapseEmptyDivs();gpt_inline2.enableServices();gpt_inline2.display('gpt-inline2-passback');}); “Selanjutnya saudara Dadan Hindayana sebagai kepala Badan Gizi Nasional. Siapa yang membentuk badan gizi nasional siapa yang tanda tangan sebelum oktober 20 yang bentuk adalah Pak Joko Widodo. Katanya 19 ribu seekor sapi tiap hari tapi kita tidak pernah lihat sapi yang MBG setan.” Begitu narasi diucapkan dalam unggahan. let gpt_inline3 = window.googletag || {cmd: []};gpt_inline3.cmd.push(function() {gpt_inline3.defineSlot('/22201407306/tirto-desktop/inline-3', [[336, 280], [300, 250]], 'gpt-inline3-passback').addService(gpt_inline3.pubads());gpt_inline3.pubads().enableSingleRequest();gpt_inline3.pubads().collapseEmptyDivs();gpt_inline3.enableServices();gpt_inline3.display('gpt-inline3-passback');}); #gpt-inline3-passback{text-align:center;} Pengunggah juga menuliskan keterangan dalam unggahan: ""Dadan Hindayana sebut nama Joko Widodo menerima uang suap MBG sebesar 2 triliun, saya punya cek nota transfernya ujar Dadan #jokowi #dadanhindayana #mbg.” let gpt_inline4 = window.googletag || {cmd: []};gpt_inline4.cmd.push(function() {gpt_inline4.defineSlot('/22201407306/tirto-desktop/inline-4', [[336, 280], [300, 250]], 'gpt-inline4-passback').addService(gpt_inline4.pubads());gpt_inline4.pubads().enableSingleRequest();gpt_inline4.pubads().collapseEmptyDivs();gpt_inline4.enableServices();gpt_inline4.display('gpt-inline4-passback');}); #gpt-inline4-passback{text-align:center;} Sampai artikel ini ditulis pada Jumat (12/06/2026), unggahan tersebut telah mendapatkan 2 likes dan 5810 kali ditayangkan. Lantas, benarkah Dadan menyebut Jokowi menerima uang suap MBG sebesar Rp2 triliun? Baca juga:Kepala BGN Lapor Evaluasi MBG ke Prabowo, Ini yang Dibahas Periksa Fakta Jokowi Terima Uang Suap MBG. FOTO/Hotline Periksa Fakta Tirto",2026-06-13
35272,Salah,"Tidak Benar, Hantavirus Disebut Pandemi COVID-19 Jilid 2","tirto.id - Sebuah unggahan video beredar di media sosial Instagram yang mengklaim hantavirus sedang dirilis sebagai pandemi COVID-19 jilid 2. Video tersebut disebarkan oleh akun Instagram bernama @suara_rakyattertindas (arsip) pada Sabtu (09/05/2026). Dalam unggahan tersebut menampilkan suasana rumah sakit dengan beberapa petugas memakai alat pelindung diri (APD), yang terlihat tergesa-gesa tengah mendorong pasien, serta sejumlah orang yang turun dari ambulans lalu menari bersama. let gpt_inline2 = window.googletag || {cmd: []};gpt_inline2.cmd.push(function() {gpt_inline2.defineSlot('/22201407306/tirto-desktop/inline-2', [[336, 280], [300, 250]], 'gpt-inline2-passback').addService(gpt_inline2.pubads());gpt_inline2.pubads().enableSingleRequest();gpt_inline2.pubads().collapseEmptyDivs();gpt_inline2.enableServices();gpt_inline2.display('gpt-inline2-passback');}); “Turns Out “They” Staged The Covid Pandemic Too.” Begitu narasi tertulis dalam video. Pengunggah juga menambahkan keterangan “Hanta Virus . Pandemi Covid 19 jilid 2 sedang dirilis . #Hantavirus #viralreels #reels #indonesiagelap #indonesia.” let gpt_inline3 = window.googletag || {cmd: []};gpt_inline3.cmd.push(function() {gpt_inline3.defineSlot('/22201407306/tirto-desktop/inline-3', [[336, 280], [300, 250]], 'gpt-inline3-passback').addService(gpt_inline3.pubads());gpt_inline3.pubads().enableSingleRequest();gpt_inline3.pubads().collapseEmptyDivs();gpt_inline3.enableServices();gpt_inline3.display('gpt-inline3-passback');}); #gpt-inline3-passback{text-align:center;} Sampai artikel ini ditulis pada Jumat (12/06/2026), unggahan tersebut telah mendapatkan 62 likes, 24 komentar, dan 11 kali dibagikan ulang. Dalam cuplikan video tersebut tertulis nama pengunggah asli @conspiracy.deception. let gpt_inline4 = window.googletag || {cmd: []};gpt_inline4.cmd.push(function() {gpt_inline4.defineSlot('/22201407306/tirto-desktop/inline-4', [[336, 280], [300, 250]], 'gpt-inline4-passback').addService(gpt_inline4.pubads());gpt_inline4.pubads().enableSingleRequest();gpt_inline4.pubads().collapseEmptyDivs();gpt_inline4.enableServices();gpt_inline4.display('gpt-inline4-passback');}); #gpt-inline4-passback{text-align:center;} Tirto juga menemukan unggahan serupa pada akun Instagram @terrifyingoldhistoryscary, @stanica_florinsfi, dan @hauntingclips. Semua unggahan tersebut menampilkan cuplikan video serupa terkait pandemi COVID-19. Namun video tersebut tidak mengklaim hantavirus sebagai pandemi COVID-19 jilid 2. Lantas, benarkah hantavirus adalah virus yang dirilis untuk pandemi COVID-19 jilid 2? Baca juga:Keliru, Episode The Simpsons Prediksi Penyebaran Hantavirus Periksa Fakta Hantavirus Covid Jilid 2. FOTO/Hotline Periksa Fakta Tirto",2026-06-12
