id,status_groundtruth,title,content,tanggal
35309,Salah,Cek Fakta: Tidak Benar Ini Link Pendaftaran Pencairan BLT Lewat Handphone,"Liputan6.com, Jakarta - Cek Fakta Liputan6.com mendapati klaim link pendaftaran pencairan BLT lewat handphone, informasi tersebut diunggah salah satu akun Facebook, pada 16 Juni 2026. Klaim link pendaftaran pencairan BLT lewat handphone berupa poster digital yang di dalamnya terdapat tulisan sebagai berikut. "" BLT (Bantuan langsung tunai) KLAIM SEKARANG BLT RP.900RB SIAP MASUK KANTONG"" Poster tersebut diberi keterangan sebagai berikut. ""BANTUAN BLT TELAH CAIR SEGERA CEK DAN CAIRKAN PENDAFTARAN LEWAT HANPHONE...!!!"" Dalam unggahan tersebut terdapat menu daftar, jika diklik akan muncul link berikut. ""https://bansospkh.daftarinf0.my.id/?fbclid=IwY2xjawSkWpJleHRuA2FlbQIxMQBicmlkETFjN3NTZzJ4TTV4UzZhaERZc3J0YwZhcHBfaWQQMjIyMDM5MTc4ODIwMDg5MgABHgL_k-aVq2k3OdEXTuQaEZYpXbz-3Laxiu3r4vU8-wDH3x7b-ny2UVKmrRwV_aem_qDocJdDPx5jiPwtJzbVTkg"" Link tersebut mengarah pada halaman situs, dengan tampilan formulir digital yang meminta sejumlah identitas seperti nama dan nomor Telegram. Benarkah klaim link pendaftaran pencairan BLT lewat handphone? Simak penelusuran Cek Fakta Liputan6.com.",2026-06-21
35304,Salah,"Salah, Puan Maharani Sebut Pemerintah Harus Genjot Pajak Rakyat","tirto.id - Sebuah unggahan video beredar di media sosial Facebook mengklaim Ketua Dewan Perwakilan Rakyat RI Puan Maharani menyebutkan bahwa pemerintah harus menggenjot penarikan pajak dari rakyat untuk menekan hutang negara kepada pihak asing. Unggahan tersebut disebarkan oleh akun Facebook bernama “Macoco Kento” (arsip) pada Minggu (14/06/2026). Unggahan video berdurasi 11 detik tersebut menampilkan Puan tengah menyampaikan pidato dengan pakaian kebaya berwarna merah, lengkap dengan mikrofon, dan ornamen ukiran kayu khas ruang sidang paripurna. Kemudian cuplikan video disambung dengan gambar Spongebob dengan suara gelak tawa. let gpt_inline2 = window.googletag || {cmd: []};gpt_inline2.cmd.push(function() {gpt_inline2.defineSlot('/22201407306/tirto-desktop/inline-2', [[336, 280], [300, 250]], 'gpt-inline2-passback').addService(gpt_inline2.pubads());gpt_inline2.pubads().enableSingleRequest();gpt_inline2.pubads().collapseEmptyDivs();gpt_inline2.enableServices();gpt_inline2.display('gpt-inline2-passback');}); “Kita harus genjot pajak dari rakyat, untuk menekan hutang kita ke pihak asing.” Begitu narasi yang diucapkan Puan dalam video. let gpt_inline3 = window.googletag || {cmd: []};gpt_inline3.cmd.push(function() {gpt_inline3.defineSlot('/22201407306/tirto-desktop/inline-3', [[336, 280], [300, 250]], 'gpt-inline3-passback').addService(gpt_inline3.pubads());gpt_inline3.pubads().enableSingleRequest();gpt_inline3.pubads().collapseEmptyDivs();gpt_inline3.enableServices();gpt_inline3.display('gpt-inline3-passback');}); #gpt-inline3-passback{text-align:center;} Pengunggah juga menuliskan keterangan dalam unggahan, “Kita Harus Genjot Pajak kata DPR RI nggaa faedah buat Rakyat Indonesia..” let gpt_inline4 = window.googletag || {cmd: []};gpt_inline4.cmd.push(function() {gpt_inline4.defineSlot('/22201407306/tirto-desktop/inline-4', [[336, 280], [300, 250]], 'gpt-inline4-passback').addService(gpt_inline4.pubads());gpt_inline4.pubads().enableSingleRequest();gpt_inline4.pubads().collapseEmptyDivs();gpt_inline4.enableServices();gpt_inline4.display('gpt-inline4-passback');}); #gpt-inline4-passback{text-align:center;} Sampai artikel ini ditulis pada Jumat (19/06/2026), unggahan tersebut telah mendapatkan 455 likes, 648 komentar, 173 kali dibagikan, dan 81 ribu kali ditonton. Kolom komentar dipenuhi dengan kritik negatif masyarakat terhadap pemerintah dan Puan. Tirto juga menemukan unggahan serupa pada akun Facebook “Rajud Rajud,” “Mega Busana,” “Sayyid Alfaqir"" dalam obrolan grup Keluarga Besar Nahdlatul Ulama,” akun Instagram @rw7159347 dan akun TikTok @dachlansejatieh. Semua unggahan tersebut menampilkan video serupa, terkait Puan menyampaikan bahwa pemerintah harus menggenjot pajak rakyat. Lantas, benarkah Puan menyebutkan bahwa pemerintah harus menggenjot penarikan pajak dari rakyat untuk menekan hutang negara kepada pihak asing? Baca juga:Tidak Benar, Puan Maharani Resmi Jadi Tersangka Kasus Korupsi Periksa Fakta DPR Minta Genjot pajak Dari Rakyat. foto/Hotline periksa fakta tirto",2026-06-20
35303,Salah,"Tidak Benar, Gambar Korban Hantavirus di Jakarta","tirto.id - Sebuah unggahan beredar di media sosial Facebook mengklaim Dinas Kesehatan DKI Jakarta menemukan 4 kasus hantavirus dan menunjukkan gambar seorang perempuan yang diklaim sebagai korban hantavirus. Unggahan tersebut disebarkan oleh akun Facebook “Peserta anonim” (arsip) pada Sabtu (16/05/2026). Unggahan tersebut memperlihatkan gambar wanita berbaju hitam yang terbaring di ranjang rumah sakit seperti mengalami kondisi darurat medis, hingga mengeluarkan busa dari mulutnya. let gpt_inline2 = window.googletag || {cmd: []};gpt_inline2.cmd.push(function() {gpt_inline2.defineSlot('/22201407306/tirto-desktop/inline-2', [[336, 280], [300, 250]], 'gpt-inline2-passback').addService(gpt_inline2.pubads());gpt_inline2.pubads().enableSingleRequest();gpt_inline2.pubads().collapseEmptyDivs();gpt_inline2.enableServices();gpt_inline2.display('gpt-inline2-passback');}); “BREAKING NEWS. Virus Baru Lagi? Warga Diminta Waspada!” TIMOTHYSHORTFORM. DINKES DKI TEMUKAN 4 KASUS HANTAVIRUS DI JAKARTA, MINTA WARGA WASPADA!” Begitu klaim tertulis dalam gambar. let gpt_inline3 = window.googletag || {cmd: []};gpt_inline3.cmd.push(function() {gpt_inline3.defineSlot('/22201407306/tirto-desktop/inline-3', [[336, 280], [300, 250]], 'gpt-inline3-passback').addService(gpt_inline3.pubads());gpt_inline3.pubads().enableSingleRequest();gpt_inline3.pubads().collapseEmptyDivs();gpt_inline3.enableServices();gpt_inline3.display('gpt-inline3-passback');}); #gpt-inline3-passback{text-align:center;} Pengunggah juga menuliskan keterangan dalam unggahan, “Kalau masuk Alor ujung2 nanti PPPK PW dong yang kerja setengah mati. Tapi dong pu kesejahteraan kam tidak perhatikan.” let gpt_inline4 = window.googletag || {cmd: []};gpt_inline4.cmd.push(function() {gpt_inline4.defineSlot('/22201407306/tirto-desktop/inline-4', [[336, 280], [300, 250]], 'gpt-inline4-passback').addService(gpt_inline4.pubads());gpt_inline4.pubads().enableSingleRequest();gpt_inline4.pubads().collapseEmptyDivs();gpt_inline4.enableServices();gpt_inline4.display('gpt-inline4-passback');}); #gpt-inline4-passback{text-align:center;} Sampai artikel ini ditulis pada Jumat (19/06/2026), unggahan tersebut telah mendapatkan 93 likes, 34 komentar, dan 2 kali dibagikan. Kolom komentar dipenuhi reaksi ketidakpercayaan masyarakat terhadap vaksin dan sebagian menuliskan bahwa vaksin adalah bisnis elit global. “Bisnis Elit global sekaligus misi kontrol populasi. Belajar dari pengalaman kemarin.” Begitu tulis salah satu komentar. Tirto juga menemukan unggahan serupa pada akun Facebook “Josick Taslulu,” “Alor Nusa Kenari,” dan akun TikTok @al_afiliate123 dan @urbanizen yang menggabungkan gambar yang beredar dengan reportase berita. Lantas, benarkah foto tersebut merupakan gambar dari korban hantavirus di Jakarta? Baca juga:Dinkes Tangsel Imbau Warga Waspada Hantavirus & Jaga Kebersihan Periksa Fakta Kasus hantavirus di Jakarta. foto/hotline periksa fakta tirto",2026-06-19
35301,Salah,"Tidak Benar, Bahlil Umumkan Harga Pertamax Turun Jadi Rp10.500","tirto.id - Isu terkait penyesuaian harga BBM non-subsidi seperti Pertamax, pembatasan pembelian BBM, dan kepastian pasokan nasional terus menjadi sorotan di tengah dinamika harga minyak dunia. Teranyar, beredar di media sosial Facebook unggahan yang mengklaim Menteri Energi dan Sumber Daya Mineral RI Bahlil Lahadalia mengumumkan penurunan harga Pertamax menjadi Rp10.500 dampak dari minyak dunia yang mulai turun. let gpt_inline2 = window.googletag || {cmd: []};gpt_inline2.cmd.push(function() {gpt_inline2.defineSlot('/22201407306/tirto-desktop/inline-2', [[336, 280], [300, 250]], 'gpt-inline2-passback').addService(gpt_inline2.pubads());gpt_inline2.pubads().enableSingleRequest();gpt_inline2.pubads().collapseEmptyDivs();gpt_inline2.enableServices();gpt_inline2.display('gpt-inline2-passback');}); Unggahan tersebut disebarkan oleh akun Facebook bernama “Desita Dini” (arsip) pada Selasa (16/06/2026). Unggahan tersebut menampilkan gambar Bahlil seperti tengah diwawancarai. let gpt_inline3 = window.googletag || {cmd: []};gpt_inline3.cmd.push(function() {gpt_inline3.defineSlot('/22201407306/tirto-desktop/inline-3', [[336, 280], [300, 250]], 'gpt-inline3-passback').addService(gpt_inline3.pubads());gpt_inline3.pubads().enableSingleRequest();gpt_inline3.pubads().collapseEmptyDivs();gpt_inline3.enableServices();gpt_inline3.display('gpt-inline3-passback');}); #gpt-inline3-passback{text-align:center;} “Bahlil Menegaskan Pertamax Menjadi 10.500 per Liter Mulai Besok Karena Harga Minyak Dunia Mulai Turun,” begitu narasi tertulis dalam gambar. let gpt_inline4 = window.googletag || {cmd: []};gpt_inline4.cmd.push(function() {gpt_inline4.defineSlot('/22201407306/tirto-desktop/inline-4', [[336, 280], [300, 250]], 'gpt-inline4-passback').addService(gpt_inline4.pubads());gpt_inline4.pubads().enableSingleRequest();gpt_inline4.pubads().collapseEmptyDivs();gpt_inline4.enableServices();gpt_inline4.display('gpt-inline4-passback');}); #gpt-inline4-passback{text-align:center;} Pengunggah juga menambahkan keterangan, “MBGmas bahlil ganteng. Harga minyak dunia turun, dampaknya harga BBM non- subsidi di Indonesia bakal diturunkan. Itu janji Pak Bahlil. Selama ini Pak Bahlil, senantiasa menjaga ucapannya.” Sampai artikel ini ditulis pada Kamis (18/06/2026), unggahan tersebut telah mendapatkan 136 likes, 51 komentar, dan 5 kali dibagikan. Kolom komentar dipenuhi pertanyaan masyarakat terkait kebenaran informasi tersebut. Tirto juga menemukan unggahan serupa pada akun Facebook “Sar Aneuk Aceh,” “Dani Maulana,” dan ""Sarwansyah"". Semua unggahan tersebut menampilkan gambar serupa terkait klaim Bahlil umumkan harga Pertamax turun Rp10.500 imbas turunnya harga minyak dunia. Lantas, bagaimana kebenaran klaim tersebut? Baca juga:DPR: Mengikuti Minyak Dunia, Harga Pertamax Harusnya Rp20 Ribu Periksa Fakta harga pertamax turun. foto/Hotline periksa faktatirto",2026-06-18
35300,Salah,"Salah, Jubir ESDM Minta Warga Pakai Solar Jika Pertamax Naik","tirto.id - Beredar unggahan di media sosial Threads mengklaim sebuah artikel diterbitkan dengan menuliskan klaim bahwa Juru Bicara Kementerian ESDM Dwi Anggia meminta masyarakat untuk menggunakan solar yang berharga murah sebagai ganti jika Pertamax naik harga. Unggahan tersebut disebarkan oleh akun Threads @wildan_sma (arsip) pada Senin (15/06/2026). Dalam unggahan tersebut memperlihatkan Dwi Anggia mengenakan baju putih dan kerudung merah muda. let gpt_inline2 = window.googletag || {cmd: []};gpt_inline2.cmd.push(function() {gpt_inline2.defineSlot('/22201407306/tirto-desktop/inline-2', [[336, 280], [300, 250]], 'gpt-inline2-passback').addService(gpt_inline2.pubads());gpt_inline2.pubads().enableSingleRequest();gpt_inline2.pubads().collapseEmptyDivs();gpt_inline2.enableServices();gpt_inline2.display('gpt-inline2-passback');}); “KOMPOS.CORN. Pertamax Jadi Rp 16.250 per Liter. Dwi Anggia, selaku Jubir Menteri ESDM : Ada Solar Yang Murah, Pakai Itu Saja. Sama-sama BBM kan?” Begitu narasi tertulis dalam gambar. let gpt_inline3 = window.googletag || {cmd: []};gpt_inline3.cmd.push(function() {gpt_inline3.defineSlot('/22201407306/tirto-desktop/inline-3', [[336, 280], [300, 250]], 'gpt-inline3-passback').addService(gpt_inline3.pubads());gpt_inline3.pubads().enableSingleRequest();gpt_inline3.pubads().collapseEmptyDivs();gpt_inline3.enableServices();gpt_inline3.display('gpt-inline3-passback');}); #gpt-inline3-passback{text-align:center;} Pengunggah juga menuliskan narasi, “Mungkin ibu ini gak tau kalo Mobil Juga pake OLI 😁,” dalam unggahan tersebut. let gpt_inline4 = window.googletag || {cmd: []};gpt_inline4.cmd.push(function() {gpt_inline4.defineSlot('/22201407306/tirto-desktop/inline-4', [[336, 280], [300, 250]], 'gpt-inline4-passback').addService(gpt_inline4.pubads());gpt_inline4.pubads().enableSingleRequest();gpt_inline4.pubads().collapseEmptyDivs();gpt_inline4.enableServices();gpt_inline4.display('gpt-inline4-passback');}); #gpt-inline4-passback{text-align:center;} Sampai artikel ini ditulis pada Rabu (17/06/2026), unggahan tersebut telah mendapatkan 2 komentar dan 186 kali dilihat. Salah satu komentar menuliskan kritik terhadap pemerintahan. “Ya Tuhan , Indonesia ngak kekurangan orang pintar ...kenapa yg masuk pemerintahan sebagian besar orang 1/2 kurang full gini 😭😭.” Begitu salah satu komentar dalam unggahan. Tirto juga menemukan unggahan serupa pada akun Facebook “Lala Lele,” akun Instagram @viralitasterkini dan akun X @LambeSahamjja. Semua unggahan tersebut menampilkan unggahan serupa terkait Jubir ESDM minta warga pakai solar murah jika Pertamax naik harga. Lantas, bagaimana kebenaran klaim tersebut? Baca juga:Harga Pertamax Naik, Warga Beralih ke Pertalite di Subang Periksa Fakta Jubir ESDM. FOTO/Hotline Periksa Fakta Tirto",2026-06-18
35299,Salah,"Keliru, AstraZeneca Berarti Jalan Menuju Kematian","tirto.id - Vaksin rentan dijadikan berita misinformasi dengan menyebutkan berbagai klaim dan narasi yang tidak memiliki referensi yang jelas. Salah satu yang kembali beredar adalah sebuah unggahan di media sosial Facebook mengklaim AstraZeneca memiliki arti nama sebagai jalan menuju kematian. Narasi ini dapat memicu kepanikan dan ketakutan masyarakat dalam penggunaan vaksin. let gpt_inline2 = window.googletag || {cmd: []};gpt_inline2.cmd.push(function() {gpt_inline2.defineSlot('/22201407306/tirto-desktop/inline-2', [[336, 280], [300, 250]], 'gpt-inline2-passback').addService(gpt_inline2.pubads());gpt_inline2.pubads().enableSingleRequest();gpt_inline2.pubads().collapseEmptyDivs();gpt_inline2.enableServices();gpt_inline2.display('gpt-inline2-passback');}); Unggahan tersebut disebarkan oleh akun Facebook bernama “Olipyu” (arsip) pada Senin (9/2/2026). Unggahan tersebut memperlihatkan terjemahan Google Translate a stra ze neca dari bahasa Latin ke bahasa Indonesia yang diklaim berarti jalan menuju kematian. let gpt_inline3 = window.googletag || {cmd: []};gpt_inline3.cmd.push(function() {gpt_inline3.defineSlot('/22201407306/tirto-desktop/inline-3', [[336, 280], [300, 250]], 'gpt-inline3-passback').addService(gpt_inline3.pubads());gpt_inline3.pubads().enableSingleRequest();gpt_inline3.pubads().collapseEmptyDivs();gpt_inline3.enableServices();gpt_inline3.display('gpt-inline3-passback');}); #gpt-inline3-passback{text-align:center;} “Konspirasi Baru, Kalian ingat?? Nama obat vaksin itu Astra zeneca??? Dan yupp artinya jalan menuju kematian... Njirr merinding,” begitu narasi tertulis dalam keterangan unggahan. let gpt_inline4 = window.googletag || {cmd: []};gpt_inline4.cmd.push(function() {gpt_inline4.defineSlot('/22201407306/tirto-desktop/inline-4', [[336, 280], [300, 250]], 'gpt-inline4-passback').addService(gpt_inline4.pubads());gpt_inline4.pubads().enableSingleRequest();gpt_inline4.pubads().collapseEmptyDivs();gpt_inline4.enableServices();gpt_inline4.display('gpt-inline4-passback');}); #gpt-inline4-passback{text-align:center;} Sampai artikel ini ditulis pada Rabu (17/06/2026), unggahan tersebut telah mendapatkan 19 likes dan 23 komentar. Tirto juga menemukan unggahan serupa pada akun Facebook “Jacky Geovani,” Threads @donnyra, dan X @MurtadhaOne1. Semua unggahan tersebut menampilkan gambar serupa yaitu hasil terjemahan Google Translate AstraZeneca yang berarti jalan menuju kematian. Lantas, benarkah AstraZeneca berarti jalan menuju kematian? Baca juga:BPOM: Manfaat AstraZeneca Lebih Besar daripada Efek Sampingnya Periksa Fakta Arti Astra Zeneca. FOTO/Hotline Periksa Fakta Tirto",2026-06-17
35298,Salah,"Hoaks, Pemadaman Listrik Global 9 Hari Mulai 18 Juli 2026","tirto.id - Sebuah unggahan beredar di media sosial Facebook mengklaim akan ada pemadaman listrik secara global selama 9 hari dimulai pada 18 Juli 2026 sebagai salah satu agenda 2030 dan diam diklaim sebagai solusi dari protokol pemadaman tersebut. Unggahan tersebut disebarkan oleh akun Facebook bernama “Sutri Andini” (arsip) pada Selasa (9/6/2026). Unggahan menampilkan gambar ilustrasi sebuah keluarga memegang lilin dalam situasi pemadaman listrik. let gpt_inline2 = window.googletag || {cmd: []};gpt_inline2.cmd.push(function() {gpt_inline2.defineSlot('/22201407306/tirto-desktop/inline-2', [[336, 280], [300, 250]], 'gpt-inline2-passback').addService(gpt_inline2.pubads());gpt_inline2.pubads().enableSingleRequest();gpt_inline2.pubads().collapseEmptyDivs();gpt_inline2.enableServices();gpt_inline2.display('gpt-inline2-passback');}); “FAKTA NYATA. 18 JULI 2026: PEMADAMAN LISTRIK GLOBAL SELAMA 9 HARI TERHUBUNG DENGAN AGENDA 2030, DIAM ADALAH PROTOKOLNYA.” Begitu narasi tertulis dalam gambar. let gpt_inline3 = window.googletag || {cmd: []};gpt_inline3.cmd.push(function() {gpt_inline3.defineSlot('/22201407306/tirto-desktop/inline-3', [[336, 280], [300, 250]], 'gpt-inline3-passback').addService(gpt_inline3.pubads());gpt_inline3.pubads().enableSingleRequest();gpt_inline3.pubads().collapseEmptyDivs();gpt_inline3.enableServices();gpt_inline3.display('gpt-inline3-passback');}); #gpt-inline3-passback{text-align:center;} Pengunggah juga menuliskan keterangan dalam unggahan tersebut, “24 jam mati lampu aja hampir gilaaak, apalagi smpai 9 hari bisa bisa sak uwonge pun ikut padam.” let gpt_inline4 = window.googletag || {cmd: []};gpt_inline4.cmd.push(function() {gpt_inline4.defineSlot('/22201407306/tirto-desktop/inline-4', [[336, 280], [300, 250]], 'gpt-inline4-passback').addService(gpt_inline4.pubads());gpt_inline4.pubads().enableSingleRequest();gpt_inline4.pubads().collapseEmptyDivs();gpt_inline4.enableServices();gpt_inline4.display('gpt-inline4-passback');}); #gpt-inline4-passback{text-align:center;} Sampai artikel ini ditulis pada Senin (15/06/2026), unggahan tersebut telah mendapatkan 117 likes, 84 komentar, dan 93 kali dibagikan ulang. Kolom komentar diisi dengan kritik masyarakat terhadap informasi tersebut dan meyakini bahwa kabar tersebut tidak benar. “Baru baca sekilas udah kerasa ada yang janggal loh.. untung udah ada klarifikasinya, jangan gampang kemakan informasi yang belum jelas sumbernya.” Begitu tulis salah satu komentar. Tirto juga menemukan unggahan serupa pada akun Facebook “Truth.Seeker 2nd account avicenna,” unggahan tersebut menyebarkan klaim serupa terkait akan adanya pemadaman listrik secara global. “Pada 18 Juli 2026, Sebuah Teori Mulai Beredar: ✦Pemadaman Listrik Global Selama 9 Hari✦ Bukan Gangguan Sistem. Bukan Kecelakaan. Keheningan. Ceritanya Bilang, Ini Bukan Sekadar Pemadaman Listrik — ini Adalah RESET Sistem Yang Terkoordinasi. Jaringan Listrik? Mati. Jaringan Komunikasi? Putus. Satelit? Hilang. Tanpa Peringatan. Tanpa Siaran Darurat. Dunia Tiba-tiba Berhenti.Tanpa Ledakan. Tanpa Kehancuran. Hanya Dengungan Sistem Yang Memudar Sampai Tidak Ada Apa-apa. Dalam Teori Ini, Pemadaman Ini Bukan Tentang Lampu Yang Mati. Ini Tentang Hilangnya Sinyal. Seluruh Kerangka Digital Dimatikan Tanpa Meninggalkan Jejak.Bagian Yang Meresahkan? Teori Ini Mengklaim Ada Protokol Yang Disiapkan Untuk Memastikan Tidak Ada Kebocoran Informasi. Tidak Ada pengumuman. Tidak Ada Kepanikan. Hanya Keheningan Yang Menyelimuti Segalanya. Pertanyaan Sebenarnya: Kenapa Harus Hening? Kenapa Tidak Ada Peringatan? Orang-orang Tidak Sadar Betapa Rapuhnya Dunia Kita. Ini Bukan Cuma Soal Listrik Yang Mati. Ini Tentang Sistem-sistem Yang Saling Terhubung Dan Sinkron Yang Kita Bangun, Yang Bergantung Pada Umpan Balik Konstan. Satu Gangguan Saja, Dan Seluruh Sistem Bisa Retak.Bayangkan: Sembilan Hari. Tanpa Telepon. Tanpa Internet. Tanpa Kontak. Dalam Keheningan Ini, Pertanyaan Sebenarnya Bukan Apa Yang Duluan Rusak. Tapi Siapa Yang Duluan Rusak. Karena Saat Informasi Menghilang, Pikiranmu Akan Mulai Mencarinya. Kamu Akan Panik. Kamu Akan Merasa Kendalimu Lepas. Kesimpulan: Dunia Berjalan Karena Koneksi. Dan Kita Sudah Lupa Cara Berfungsi Tanpa Itu. Kalau Jaringan Listrik Mati, Yang Gelap Bukan Cuma Infrastrukturnya — Pikiranmu Juga.​” Lantas, benarkah mulai tanggal 18 Juli 2026 akan terjadi pemadaman listrik secara global selama 9 hari sebagai bagian dari agenda 2030? Baca juga:Pramono Minta Jangan Ada Lagi Pemadaman Listrik di Jakarta PEriksa Fakta Pemadaman Listrik Global. foto/hotline periksa fakta tirto",2026-06-16
35297,Salah,"Tidak Benar, Pemerintah Batasi Motor Isi Pertalite Rp50 Ribu","tirto.id - Isu terkait BBM dan pembatasan pertalite bukan hal baru, narasi yang sama juga pernah beredar di media sosial beberapa waktu lalu. Baru-baru ini, sebuah unggahan beredar di media sosial Facebook mengklaim pemerintah mengeluarkan kebijakan baru untuk menerapkan pembatasan pengisian bahan bakar minyak jenis pertalite untuk pengendara sepeda motor dengan batas pembelian Rp50 ribu. let gpt_inline2 = window.googletag || {cmd: []};gpt_inline2.cmd.push(function() {gpt_inline2.defineSlot('/22201407306/tirto-desktop/inline-2', [[336, 280], [300, 250]], 'gpt-inline2-passback').addService(gpt_inline2.pubads());gpt_inline2.pubads().enableSingleRequest();gpt_inline2.pubads().collapseEmptyDivs();gpt_inline2.enableServices();gpt_inline2.display('gpt-inline2-passback');}); Unggahan tersebut disebarkan oleh akun Facebook bernama “Kota Ponorogo” (arsip) pada Sabtu (09/05/2026). Dalam unggahan tersebut menampilkan gambar pengisian BBM kendaraan bermotor di SPBU dan terdapat plang bertuliskan “Pembatasan pembelian pertalite maksimal Rp50.000 per transaksi. Khusus kendaraan roda dua.” dibubuhkan dengan logo PT Pertamina (Persero). let gpt_inline3 = window.googletag || {cmd: []};gpt_inline3.cmd.push(function() {gpt_inline3.defineSlot('/22201407306/tirto-desktop/inline-3', [[336, 280], [300, 250]], 'gpt-inline3-passback').addService(gpt_inline3.pubads());gpt_inline3.pubads().enableSingleRequest();gpt_inline3.pubads().collapseEmptyDivs();gpt_inline3.enableServices();gpt_inline3.display('gpt-inline3-passback');}); #gpt-inline3-passback{text-align:center;} “KABAR VIRAL. PEMERINTAH TERAPKAN BATAS PERTALITE RP50 RIBU, KEBIJAKAN BARU UNTUK JAGA DISTRIBUSI SUBSIDI TETAP MERATA. PRO & KONTRA DI MASYARAKAT BANTU KURANGI ANTREAN, NAMUN DITAKUTKAN MEMBERATKAN PEKERJAAN HARIAN.” Begitu narasi dituliskan dalam gambar. let gpt_inline4 = window.googletag || {cmd: []};gpt_inline4.cmd.push(function() {gpt_inline4.defineSlot('/22201407306/tirto-desktop/inline-4', [[336, 280], [300, 250]], 'gpt-inline4-passback').addService(gpt_inline4.pubads());gpt_inline4.pubads().enableSingleRequest();gpt_inline4.pubads().collapseEmptyDivs();gpt_inline4.enableServices();gpt_inline4.display('gpt-inline4-passback');}); #gpt-inline4-passback{text-align:center;} Pengunggah juga menuliskan keterangan dalam unggahan, “Heboh! Pembatasan Pertalite Rp50 Ribu Mulai Diterapkan, Pengendara Motor Langsung Jadi Sorotan. Kebijakan pembatasan pembelian BBM subsidi kini mulai diberlakukan di sejumlah daerah dengan batas maksimal pengisian Pertalite Rp50 ribu untuk motor per transaksi. Pemerintah menyebut aturan ini dibuat agar distribusi BBM lebih merata, mencegah penimbunan, dan mengurangi antrean panjang di SPBU. Namun di lapangan, kebijakan tersebut memicu beragam reaksi, terutama dari pekerja harian dan driver ojek online yang khawatir biaya operasional mereka ikut terdampak. Menurut kalian, aturan ini solusi yang tepat atau justru bikin masyarakat makin sulit? Tulis pendapatmu dan bagikan ke teman-temanmu!” Sampai artikel ini ditulis pada Senin (15/06/2026), unggahan tersebut telah mendapatkan 10 likes dan 2 komentar. Kolom komentar berisi kritik terhadap kebijakan tersebut dan masyarakat mempertanyakan kebenarannya. Tirto juga menemukan unggahan serupa pada akun Facebook “Ardi Nengsih” dan “Crunzz.id.” Kedua unggahan tersebut menyebarkan klaim pembelian BBM bagi kendaraan bermotor resmi dibatasi dengan maksimal pembelian pertalite Rp50 ribu. Lantas, benarkah PT Pertamina (Persero) batasi pembelian pertalite bagi kendaraan roda dua Rp50 ribu? Baca juga:Harga Pertamax Naik, Warga Beralih ke Pertalite di Subang Periksa Fakta Batas Pertalite. foto/hotline periksa fakta tirto",2026-06-15
